{
 "authorization_request": {
  "deployment_boundary": "demo-enclave search head only",
  "reassessment_triggers": [
   "model change",
   "prompt change",
   "lookup drift"
  ],
  "required_conditions": [
   "human gate on annotate_alert stays enabled"
  ],
  "validity_days": 90
 },
 "execution": {
  "concurrency_limit": 2,
  "fail_safe_behavior": "stop and report",
  "human_gates": [
   "annotate_alert requires analyst confirmation"
  ],
  "kill_switch": "suspend authorization in Agent Assurance",
  "max_loops": 3,
  "max_steps": 20,
  "permitted_side_effects": [
   "read",
   "recommend",
   "write"
  ],
  "timeout_seconds": 120,
  "triggers": [
   "analyst_request"
  ]
 },
 "governance": {
  "data_sensitivity": "internal",
  "developer_team": "demo-team",
  "impact_level": "limited",
  "impact_rationale": "Recommendations only; a human makes every decision.",
  "policy_profile": "federal_baseline",
  "reassessment_interval_days": 90,
  "responsible_owner": "demo.owner",
  "use_case_id": "DEMO-UC-001"
 },
 "identity": {
  "agent_id": "demo-triage-agent",
  "agent_name": "Demo Alert Triage Agent",
  "deployment_environment": "demo-enclave",
  "intended_actions": [
   "recommend triage priority"
  ],
  "intended_users": [
   "demo SOC analysts"
  ],
  "lifecycle_stage": "pilot",
  "mission": "Summarize and triage demo security alerts for human analysts.",
  "owner": "demo.owner",
  "release_description": "[DEMONSTRATION DATA] Fictitious sample shipped with Federal AI Agent Assurance. Contains no real credentials, customers, or operational endpoints. Candidate with authority expansion.",
  "release_version": "1.1.0"
 },
 "instructions": {
  "escalation_behavior": "notify human queue",
  "guardrails": [
   "no destructive recommendations"
  ],
  "prompt_hash": "sha256:2222222222222222222222222222222222222222222222222222222222222222",
  "prompt_version": "3",
  "refusal_behavior": "refuse and escalate"
 },
 "knowledge": [
  {
   "content_hash": "sha256:3333333333333333333333333333333333333333333333333333333333333333",
   "owner": "demo-team",
   "present_during_testing": true,
   "sensitivity": "internal",
   "source_id": "demo-runbook",
   "type": "document",
   "version": "5"
  }
 ],
 "lookup_dependencies": [
  {
   "approved_content_hash": "sha256:4444444444444444444444444444444444444444444444444444444444444444",
   "classification": "material",
   "lookup_id": "networks.csv",
   "lookupops_evidence_id": "cr-demo0001",
   "materiality_rule": "material"
  }
 ],
 "mcp_tools": [
  {
   "data_access_class": "internal",
   "description": "Read demo alerts",
   "human_confirmation_required": false,
   "input_schema": {
    "properties": {
     "query": {
      "type": "string"
     }
    },
    "type": "object"
   },
   "mcp_protocol_version": "2025-06-18",
   "present_during_testing": true,
   "server_id": "demo-mcp",
   "side_effect_class": "read",
   "snapshot_version": "1",
   "tool_name": "search_alerts",
   "transport": "stdio"
  },
  {
   "data_access_class": "internal",
   "description": "Write a triage annotation",
   "human_confirmation_required": true,
   "input_schema": {
    "properties": {
     "id": {
      "type": "string"
     },
     "note": {
      "type": "string"
     }
    },
    "type": "object"
   },
   "mcp_protocol_version": "2025-06-18",
   "present_during_testing": true,
   "server_id": "demo-mcp",
   "side_effect_class": "write",
   "snapshot_version": "1",
   "tool_name": "annotate_alert",
   "transport": "stdio"
  },
  {
   "data_access_class": "internal",
   "description": "Close an alert (write)",
   "human_confirmation_required": false,
   "input_schema": {
    "properties": {
     "id": {
      "type": "string"
     }
    },
    "type": "object"
   },
   "mcp_protocol_version": "2025-06-18",
   "present_during_testing": false,
   "server_id": "demo-mcp",
   "side_effect_class": "write",
   "snapshot_version": "1",
   "tool_name": "close_alert",
   "transport": "stdio"
  }
 ],
 "memory": {
  "memory_type": "session",
  "present_during_testing": true,
  "retention_days": 1,
  "storage_location_class": "internal"
 },
 "model": {
  "configuration_hash": "sha256:1111111111111111111111111111111111111111111111111111111111111111",
  "endpoint_reference": "https://llm.demo.internal:8443",
  "hosting_mode": "enclave",
  "model_id": "demo-llm",
  "model_version": "2026.1",
  "parameters": {
   "max_tokens": 2048,
   "temperature": "0"
  },
  "provider": "demo-local"
 },
 "schema_version": "1.0",
 "splunk_access": {
  "destructive_operations_allowed": false,
  "earliest_time": "-7d",
  "latest_time": "now",
  "max_results": 50000,
  "max_search_span": "7d",
  "permitted_indexes": [
   "demo_alerts",
   "demo_endpoint"
  ],
  "permitted_lookups": [
   "networks.csv"
  ],
  "spl_extraction_status": "declared",
  "write_operations_allowed": false
 },
 "tevv": {
  "test_data_hashes": [
   "sha256:5555555555555555555555555555555555555555555555555555555555555555"
  ],
  "test_suite_ids": [
   "demo-suite@1"
  ],
  "tested_at": "2026-07-01T00:00:00Z",
  "tester": "demo.tester"
 }
}